 报告日期,2017-09-30,2017-06-30,2016-12-31,2016-09-30,2016-06-30,2015-12-31,2014-12-31,2013-12-31, 
 销售商品、提供劳务收到的现金(万元),50395,33999,79820,55584,39305,72304,72495,59123, 
 客户存款和同业存放款项净增加额(万元),--,--,--,--,--,--,--,--, 
 向中央银行借款净增加额(万元,--,--,--,--,--,--,--,--, 
 向其他金融机构拆入资金净增加额(万元),--,--,--,--,--,--,--,--, 
 收到原保险合同保费取得的现金(万元),--,--,--,--,--,--,--,--, 
 收到再保险业务现金净额(万元),--,--,--,--,--,--,--,--, 
 保户储金及投资款净增加额(万元),--,--,--,--,--,--,--,--, 
 处置交易性金融资产净增加额(万元),--,--,--,--,--,--,--,--, 
 收取利息、手续费及佣金的现金(万元),--,--,--,--,--,--,--,--, 
 拆入资金净增加额(万元),--,--,--,--,--,--,--,--, 
 回购业务资金净增加额(万元),--,--,--,--,--,--,--,--, 
 收到的税费返还(万元),--,--,--,--,--,--,--,--, 
 收到的其他与经营活动有关的现金(万元),2356,1362,697,7567,549,1213,628,868, 
 经营活动现金流入小计(万元),52750,35361,80516,63151,39854,73517,73122,59991, 
 购买商品、接受劳务支付的现金(万元),32084,17233,45687,37023,21164,45372,37158,40114, 
 客户贷款及垫款净增加额(万元),--,--,--,--,--,--,--,--, 
 存放中央银行和同业款项净增加额(万元),--,--,--,--,--,--,--,--, 
 支付原保险合同赔付款项的现金(万元),--,--,--,--,--,--,--,--, 
 支付利息、手续费及佣金的现金(万元),--,--,--,--,--,--,--,--, 
 支付保单红利的现金(万元),--,--,--,--,--,--,--,--, 
 支付给职工以及为职工支付的现金(万元),3882,2664,4847,3736,2537,3782,3253,2681, 
 支付的各项税费(万元),3903,3015,5140,4713,3248,4880,3633,2082, 
 支付的其他与经营活动有关的现金(万元),2984,4212,7424,7528,3169,5369,4254,3872, 
 经营活动现金流出小计(万元),42852,27123,63097,53001,30117,59403,48298,48750, 
 经营活动产生的现金流量净额(万元),9899,8238,17419,10150,9737,14114,24824,11241, 
 收回投资所收到的现金(万元),--,--,--,--,--,--,--,--, 
 取得投资收益所收到的现金(万元),0,--,--,1,--,--,--,--, 
 处置固定资产、无形资产和其他长期资产所收回的现金净额(万元),436,6,42,543,40,74,--,5, 
 处置子公司及其他营业单位收到的现金净额(万元),--,--,--,--,--,--,--,--, 
 收到的其他与投资活动有关的现金(万元),--,456,4466,--,4111,81,47,44, 
 减少质押和定期存款所收到的现金(万元),--,--,--,--,--,--,--,--, 
 投资活动现金流入小计(万元),436,1471,13609,543,10276,2537,2739,5673, 
 购建固定资产、无形资产和其他长期资产所支付的现金(万元),2484,1623,5761,3411,4368,8574,8141,8729, 
 投资所支付的现金(万元),--,--,--,--,--,--,--,--, 
 质押贷款净增加额(万元),--,--,--,--,--,--,--,--, 
 取得子公司及其他营业单位支付的现金净额(万元),--,--,--,--,--,--,--,3368, 
 支付的其他与投资活动有关的现金(万元),--,1425,--,0,--,1959,2048,2, 
 增加质押和定期存款所支付的现金(万元),--,--,--,--,--,--,--,--, 
 投资活动现金流出小计(万元),2484,4096,17066,-1589,7197,20690,15483,20945, 
 投资活动产生的现金流量净额(万元),-2048,-2625,-3458,2132,3079,-18152,-12743,-15272, 
 吸收投资收到的现金(万元),--,--,--,--,--,--,--,--, 
 其中：子公司吸收少数股东投资收到的现金(万元),--,--,--,--,--,--,--,--, 
 取得借款收到的现金(万元),32138,27538,32000,15000,16000,38000,37150,38400, 
 发行债券收到的现金(万元),--,--,--,--,--,15232,--,--, 
 收到其他与筹资活动有关的现金(万元),--,--,--,8000,--,--,--,--, 
 筹资活动现金流入小计(万元),32138,27538,32000,23000,16000,53232,37150,38400, 
 偿还债务支付的现金(万元),24700,19768,38400,19700,17700,41450,37450,26900, 
 分配股利、利润或偿付利息所支付的现金(万元),2284,1005,2906,2454,963,2550,2780,2602, 
 其中：子公司支付给少数股东的股利、利润(万元),--,--,--,--,--,--,--,--, 
 支付其他与筹资活动有关的现金(万元),--,--,--,--,80,2533,--,--, 
 筹资活动现金流出小计(万元),26984,21005,41900,22154,18964,47619,40918,30068, 
 筹资活动产生的现金流量净额(万元),5154,6533,-9900,846,-2964,5613,-3768,8332, 
 汇率变动对现金及现金等价物的影响(万元),--,-45,104,--,52,50,--,--, 
 现金及现金等价物净增加额(万元),13005,12101,4165,13128,9904,1625,8313,4301, 
 加:期初现金及现金等价物余额(万元),27735,27335,23170,27497,23170,21545,13232,8932, 
 期末现金及现金等价物余额(万元),40740,39436,27335,33729,33074,23170,21545,13232, 
 净利润(万元),--,3774,7591,--,--,7325,6541,--, 
 少数股东损益(万元),--,--,--,--,--,--,--,--, 
 未确认的投资损失(万元),--,--,--,--,--,--,--,--, 
 资产减值准备(万元),--,10,-27,--,--,-59,-160,--, 
 固定资产折旧、油气资产折耗、生产性物资折旧(万元),--,2222,3887,--,--,3628,3343,--, 
 无形资产摊销(万元),--,40,41,--,--,44,30,--, 
 长期待摊费用摊销(万元),--,49,82,--,--,20,12,--, 
 待摊费用的减少(万元),--,--,--,--,--,--,--,--, 
 预提费用的增加(万元),--,--,--,--,--,--,--,--, 
 处置固定资产、无形资产和其他长期资产的损失(万元),--,52,16,--,--,-51,--,--, 
 固定资产报废损失(万元),--,--,--,--,--,--,--,--, 
 公允价值变动损失(万元),--,689,2369,--,--,1249,1467,--, 
 递延收益增加(减：减少)(万元),--,--,--,--,--,--,--,--, 
 预计负债(万元),--,--,--,--,--,--,--,--, 
 财务费用(万元),--,983,1666,--,--,2369,2635,--, 
 投资损失(万元),--,--,--,--,--,--,--,--, 
 递延所得税资产减少(万元),--,15,111,--,--,-145,-38,--, 
 递延所得税负债增加(万元),--,--,--,--,--,--,--,--, 
 存货的减少(万元),--,2049,1129,--,--,2229,1268,--, 
 经营性应收项目的减少(万元),--,-357,2057,--,--,-192,1840,--, 
 经营性应付项目的增加(万元),--,-686,-653,--,--,-1892,8125,--, 
 已完工尚未结算款的减少(减:增加)(万元),--,--,--,--,--,--,--,--, 
 已结算尚未完工款的增加(减:减少)(万元),--,--,--,--,--,--,--,--, 
 其他(万元),--,--,--,--,--,--,--,--, 
 经营活动产生现金流量净额(万元),--,8238,17419,--,--,14114,24824,--, 
 债务转为资本(万元),--,--,--,--,--,--,--,--, 
 一年内到期的可转换公司债券(万元),--,--,--,--,--,--,--,--, 
 融资租入固定资产(万元),--,--,--,--,--,--,--,--, 
 现金的期末余额(万元),40740,39436,27335,33729,33074,23170,21545,13232, 
 现金的期初余额(万元),27735,27335,23170,27497,23170,21545,13232,8932, 
 现金等价物的期末余额(万元),--,--,--,--,--,--,--,--, 
 现金等价物的期初余额(万元),--,--,--,--,--,--,--,--, 
 现金及现金等价物的净增加额(万元),13005,12101,4165,13128,9904,1625,8313,4301, 

